Какие структуры данных будут рассмотрены во второй части книги?;Массивы, связные списки, стеки, очереди, деревья, кучи, графы и хеш-таблицы.
Почему программисту важно понимать структуры данных?;Потому что программирование включает написание алгоритмов и выбор подходящей структуры данных для алгоритма.
Что утверждал Никлаус Вирт в контексте программирования?;«Алгоритмы + структура данных = программы». Алгоритм говорит компьютеру что делать, а структура данных говорит компьютеру как хранить данные.
Что подчеркнул Линус Торвальдс о различии между плохим и хорошим программистом?;«Разница между плохим программистом и хорошим заключается в том, что он считает более важным — свой код или свою структуру данных. Плохие программисты беспокоятся о коде. Хорошие программисты заботятся о структурах данных и их взаимосвязях».
Чем отличаются абстрактный тип данных и структура данных?;Абстрактный тип данных — это характеристика структуры данных, тогда как структура данных — фактическая реализация. Например, список — это абстрактный тип данных, а реализованный список в Python — это структура данных.
Как классифицируют структуры данных по признаку линейности/нелинейности?;Линейная структура данных упорядочивает элементы последовательно (каждый элемент имеет один предыдущий и один следующий). Нелинейная структура связывает данные непоследовательно (один элемент может быть связан со множеством других).
Что подразумевается под обходом структуры данных и как это отличается для линейных и нелинейных структур?;Обход — это переход от первого элемента к последнему. В линейной структуре можно легко перейти без отката, а в нелинейной часто требуется возвращаться к предыдущему состоянию или использовать рекурсию.
В чем разница между статическими и динамическими структурами данных?;У статической структуры данных фиксированный размер, который определяется при создании и не может измениться. Динамическая структура может увеличиваться или уменьшаться в размерах.
Почему статические структуры данных не лучший выбор, если неизвестно количество элементов заранее?;Если количество данных меньше выделенного размера, память тратится впустую. Если больше — нельзя добавить элементы, не создавая новую структуру большего размера и копируя все данные.
Почему статическая структура данных может быть уместна в программе с функцией отмены до десяти операций?;Потому что максимальное количество отмен фиксировано (десять), поэтому можно использовать статическую структуру данных с фиксированным размером.
Как различить статические и динамические структуры данных на примере массивов в Python?;Массивы в низкоуровневых языках (например, C) — статические структуры, а списки в Python — динамические массивы (их размер может меняться).
Какие преимущества и недостатки динамических структур данных по сравнению со статическими?;Преимущества: возможность легко изменять размер, эффективное добавление/удаление, рациональное использование памяти. Недостатки: более медленный доступ к элементам, больший расход памяти для хранения того же количества элементов.
Когда следует выбирать динамическую структуру данных?;Когда объем данных неопределен, особенно в ситуациях с ограниченной памятью.
На что обычно тратится больше времени при выборе структуры данных?;На решение о линейности или нелинейности структуры данных, а затем на выбор конкретного типа структуры.
Каковы основные критерии сравнения структур данных?;Эффективность при вставке, удалении, поиске, сортировке данных, а также эффективность использования пространства памяти.
Какова эффективность поиска в словаре Python?;Поиск в словаре Python невероятно эффективен, даже если в нем миллиард элементов.
Что такое обход структуры данных?;Проход от первого элемента в структуре данных к последнему.
Что такое массив?;Структура данных, которая сохраняет элементы с индексами в непрерывном блоке памяти.
Что такое однородная структура данных?;Структура, которая может хранить элементы только одного типа данных, например, только целые числа или только строки.
Какими свойствами обладают массивы в языке C?;Они статические (размер нельзя изменить после создания) и однородные (хранят элементы одного типа).
Что такое массив переменной длины?;Массив, размер которого может измениться после создания.
Что такое гетерогенный массив?;Массив, содержащий разные типы данных.
Какими свойствами обладает список Python?;Список Python — это неоднородный массив переменной длины.
Кто написал Python и на каком языке?;Гвидо ван Россум написал Python на языке C.
Какую структуру данных Python предоставляет вместо массивов?;Список (list).
Как обычно нумеруются индексы в массивах?;Первый индекс в массиве обычно равен 0.
Python и C используют индексацию, основанную на нуле или на единице?;На нуле.
Как называются адрес ячейки памяти первого элемента массива?;Базовый адрес.
Какая формула используется компьютером для расчета адреса добавления нового элемента в массив?;base_address + index * size_of_data_type
Какие бывают типы массивов по количеству измерений?;Одномерные и многомерные.
Как получить доступ к элементу в многомерном массиве?;С помощью двух целочисленных индексов (по одному на измерение).
Как компьютер хранит элементы массива в памяти?;В одном непрерывном блоке памяти.
Какова временная сложность доступа к элементу в массиве?;O(1) (постоянное время).
Чему равна временная сложность поиска в несортированном массиве?;O(n).
Чему равна временная сложность поиска в отсортированном массиве?;O(log n).
Почему вставка элемента в массив требует O(n) времени?;Потому что все элементы, следующие за добавленным, нужно сдвинуть.
Как Python делает добавление элементов в список эффективнее?;За счет процесса превышения доступности (амортизации).
Как Python обрабатывает резервирование памяти для списка и отслеживание элементов?;Python резервирует для списка больший объем памяти, чем ему необходимо на данный момент, и отслеживает количество элементов в списке, а также количество неиспользуемого пространства.
Какая структура данных рекомендуется для хранения последовательных данных в программировании?;Массив.
Приведите пример использования массива в игре типа Call of Duty для отображения топ-10 игроков.;Можно использовать массив, чтобы отслеживать топ-10 игроков: игрок с самым высоким рейтингом сохраняется под индексом 0, а с самым низким — под индексом 9.
Для каких целей программисты используют массивы помимо математических вычислений?;Для реализации других структур данных, таких как стек и очередь.
Какие языковые среды выполнения используют массивы для реализации высших структур, таких как списки в Python?;Среды выполнения многих языков программирования (включая реализацию списков Python).
Какое преимущество дают массивы NumPy в Python?;Они полезны для математических, научных и финансовых приложений, статистики, а также поддерживают математические операции, например, умножение матриц, используемое в графике для масштабирования, преобразования и поворота объектов.
Почему массив не является лучшим выбором для большого набора данных, в который нужно добавлять данные?;Потому что сложность добавления данных в массив составляет O(n), что может быть неэффективно.
Когда лучше использовать связный список вместо массива?;Когда требуется добавлять данные в набор, так как связный список более эффективен для вставки.
Какая структура данных Python предпочтительна, если нужно, чтобы данные сохраняли тот же индекс при вставке?;Словарь Python.
Как создать одномерный массив в Python с использованием встроенного модуля array?;Импортировать модуль array и использовать array.array('f', (1.0, 1.5, 2.0, 2.5)).
Что означает параметр 'f' в array.array('f', ...)?;Он указывает, что массив будет содержать числа с плавающей точкой (float).
Что произойдет, если попытаться добавить в массив с типом float данные другого типа, например, строку?;Программа выдаст ошибку TypeError: 'must be real number, not str'.
Что делает функция move_zeros в представленном коде?;Перемещает все нули в конец списка, сохраняя порядок остальных элементов.
Какая переменная отслеживает индекс для замены ненулевых элементов в алгоритме move_zeros?;zero_index.
Какой метод используется для перебора элементов с индексами в алгоритме move_zeros?;Функция enumerate.
Какой код выполняется, когда n не равно 0, в алгоритме перемещения нулей?;"if n != 0: a_list[zero_index] = n; if zero_index != index: a_list[index] = 0; zero_index += 1"
Что происходит с zero_index, когда текущий элемент равен 0?;zero_index не инкрементируется, остается на месте.
Какова временная сложность алгоритма перемещения нулей?;O(n), так как есть один основной цикл.
Как объединить два списка в список кортежей в Python?;Использовать функция zip: list(zip(list1, list2))
Что возвращает функция zip?;Объект zip, содержащий фрагменты данных из каждой итерации.
Какая структура данных в Python не допускает дубликатов?;Множество (set).
Как добавить элемент в множество?;a_set.add(element)
Как с помощью множества проверить наличие дубликатов в списке?;"Создать множество, добавлять элементы по одному; если длина не меняется, элемент уже существует."
Как работает функция return_dups?;Функция return_dups принимает итерируемый объект, создает пустое множество a_set и список dups. В цикле for для каждого элемента она сохраняет длину множества, добавляет элемент, проверяет новую длину. Если длина не изменилась, элемент добавляется в dups. Возвращает список дубликатов.
Как найти пересечение двух списков с помощью спискового включения?;Пример: def return_inter(list1, list2): return [v for v in list1 if v in list2]. Это создает новый список, содержащий элементы из list1, которые присутствуют в list2, выполняя линейный поиск (O(n²)).
Как найти пересечение двух списков с помощью множеств?;"Пример: def return_inter(list1, list2): set1 = set(list1); set2 = set(list2); return list(set1.intersection(set2)). Метод intersection возвращает общие элементы множеств."
Как использовать intersection для нескольких множеств?;Метод intersection может принимать несколько аргументов: s1.intersection(s2, s3, s4) возвращает элементы, общие для всех указанных множеств.
Как преобразовать список во множество?;Для преобразования используйте set(list_name). Пример: set1 = set([1, 2, 3]) создает множество {1, 2, 3}.
Что такое однородная структура данных?;Структура данных, которая может хранить элементы только одного типа данных, такие как целое число или число с плавающей точкой.
Что такое неоднородный массив переменной длины?;Массив, размер которого может меняться после его создания, позволяющий хранить несколько типов данных.
Что такое массив переменной длины?;Массив, размер которого может изменяться после создания.
Что такое неоднородный массив?;Массив, содержащий различные типы данных.
Что такое базовый адрес массива?;Адрес ячейки памяти первого элемента массива.
Что такое одномерный массив?;Массив, в котором вы получаете доступ к каждому элементу массива по целочисленному индексу.
Что такое многомерный массив?;Массив, в котором вы получаете доступ к каждому элементу массива с помощью кортежа индексов.
Что такое превышение доступности для списка?;Резервирование для списка большего, чем ему необходимо, объема памяти и отслеживание количества хранящихся в списке элементов и количества неиспользуемого пространства списка.
Что такое множество как структура данных?;Структура данных, которая не может содержать повторяющиеся элементы.
Что такое связный список?;Реализация списка как абстрактного типа данных, где элементы хранятся в цепочке узлов, каждый из которых содержит данные и указатель на следующий узел.
Что такое указатель в связном списке?;Информация о местоположении следующего узла в цепи.
Что такое головной узел связного списка?;Первый узел в связном списке.
Что такое односвязный список?;Тип связного списка с указателями, которые указывают только на следующий элемент.
Что такое двусвязный список?;Тип связного списка, в котором у каждого узла есть два указателя: один на следующий узел, другой на предыдущий.
Что такое круговой связный список?;Связный список, в котором последний узел указывает на первый узел, позволяя переходить от последнего элемента к началу.
Какой список называется закольцованным?;Список является закольцованным, когда любой узел в связном списке указывает на предыдущий узел.
Какая временная сложность доступа к элементу по индексу в массиве?;Постоянное время, О(1).
Какая временная сложность доступа к элементу в связном списке?;Линейный поиск, О(n).
Какая временная сложность вставки и удаления в связном списке?;О(1).
Какая временная сложность вставки и удаления в массиве?;О(n).
Какое преимущество связного списка перед массивом?;Добавление и удаление узла выполняется за O(1), тогда как в массиве — O(n).
Какие структуры данных можно создать на основе связных списков?;Стеки и очереди.
Как связные списки связаны с блокчейном?;Блокчейны идентичны связным спискам, некоторые из них используют связные списки в своей технологии.
Назовите два недостатка связного списка.;1) Каждый узел содержит указатель на следующий узел, что требует больше памяти. 2) Нет произвольного доступа (нельзя сразу перейти к элементу).
Что такое произвольный доступ в информатике?;Возможность произвольно получать доступ к данным за постоянное время.
Какой класс используется для представления узла связного списка в Python?;class Node с атрибутами data и next.
Какой класс используется для представления самого связного списка в Python?;class LinkedList с атрибутом head.
Какой метод добавляет новый узел в связный список в приведённом коде?;Метод append.
Что делает метод append, если список пуст (head is None)?;Устанавливает head в новый узел с переданными данными.
Как метод append добавляет узел в непустой список?;Проходит по списку до последнего узла (current.next is None) и устанавливает current.next = Node(data).
Что делает метод append в связном списке?;Метод append принимает фрагмент данных, создает с ним новый узел и добавляет его в связный список. Если головного узла нет, новый узел становится головным. Если головной узел есть, находит последний узел и устанавливает его next на новый узел.
Как в методе append определяется, что список пуст?;Проверяется условие: if not self.head. Если self.head равен None (ложь), список пуст.
Как в методе append находится последний узел списка?;Создается переменная current, равная self.head. Затем выполняется цикл while current.next, который продолжается, пока next не равен None. Внутри цикла current обновляется на current.next. После цикла current указывает на последний узел.
Что делает метод __str__ в классе LinkedList?;"Метод __str__ выводит все узлы списка, начиная с головного, пока не достигнет None. Он использует цикл while node is not None: print(node.data); node = node.next."
