Чем отличается ограниченная очередь от неограниченной?;Ограниченная очередь ограничивает количество добавляемых в нее элементов, а неограниченная не ограничивает.
Как реализовать очередь с помощью двух стеков с временной сложностью постановки O(1)?;Пример реализации: при enqueue помещаем элемент сразу в один из стеков, а dequeue использует второй стек для переворота порядка.
Как в Python сохранить пару 'ключ — значение' в словаре?;"a_dict = {}; a_dict[1776] = 'Independence Year'"
Как извлечь значение из словаря по ключу?;print(a_dict[1776]) -> 'Independence Year'
Что такое хеш-функция в контексте хеш-таблиц?;Функция, которая преобразует ключ (например, целое число или строку) в индекс в массиве, используя операцию остатка от деления на количество слотов.
Как сохранить число 86 в хеш-таблицу с семью слотами?;Вычислить 86 % 7 = 2, поместить число в индекс 2 массива.
Что такое коллизия в хеш-таблице?;Когда два разных ключа хешируются в один и тот же слот (например, 30 % 7 = 2, но в слот 2 уже помещено число 86).
Как разрешить коллизию в хеш-таблице?;Поместить конфликтующее число в следующий пустой слот или использовать списки (связные) в каждой ячейке.
Какая временная сложность поиска в хеш-таблице в среднем?;O(1) в среднем, но в худшем случае при коллизиях — O(n).
Какая временная сложность вставки в хеш-таблицу в среднем?;O(1) в среднем.
Почему хеш-таблицы эффективны для больших наборов данных?;Для поиска достаточно выполнить хеш-функцию над ключом и проверить один индекс массива.
Как хранятся пары 'ключ — значение' в хеш-таблице с помощью двух массивов?;Первый массив хранит ключи, второй — соответствующие значения. Хеш-функция преобразует ключ в индекс, по которому сохраняется ключ и значение в параллельных массивах.
Может ли быть дубликат ключа в словаре Python?;Нет, ключи не могут дублироваться, но значения могут повторяться.
Что происходит, когда при добавлении нового ключа возникает коллизия в хеш-таблице?;Используется метод разрешения коллизий: например, линейное пробирование (следующий пустой слот) или цепочки (связные списки).
Какую операцию используют для вычисления индекса в простейшей хеш-функции на примере?;Остаток от деления числа на количество слотов (модуль).
Какая временная сложность (средняя) для Поиска в Хеш-таблице?;O(1)
Какая временная сложность (худшая) для Вставки в Хеш-таблицу?;O(n)
Для каких структур данных (из таблицы) средняя временнáя сложность Доступа равна O(n)?;Стек, Очередь, Связный список, Двоичное дерево поиска (O(log n) в среднем, но в худшем случае O(n) – обычно для доступа O(n))
Какая структура данных имеет среднюю временную сложность Поиска O(1)?;Хеш-таблица
Что означает временнáя сложность O(1) для поиска в хеш-таблице?;Поиск данных происходит за постоянное время, независимо от размера данных.
В каком формате многие API отправляют данные, который легко преобразовать в словарь Python?;JSON (нотация объектов JavaScript)
Что использует система контроля версий Git для хранения различных версий данных?;Хеш-значения из криптографической хеш-функции.
Для каких целей операционные системы часто применяют хеш-таблицы?;Для управления памятью.
Когда стоит рассмотреть применение хеш-таблицы?;Когда имеется большой объем данных и нужно быстро получить доступ к отдельным элементам.
В каких случаях лучшим выбором может быть массив или связный список, а не хеш-таблица?;Когда часто работают с данными в последовательном порядке.
Какой тип данных в Python используется как хеш-таблица для хранения имен и значений объектных переменных?;Словари (dict)
Какая функция в примере считает количество символов в строке с использованием словаря?;count(a_string)
В примере count, что происходит, если символ уже есть в словаре?;Инкрементируется его значение (a_dict[char] += 1)
В примере count, что происходит, если символа еще нет в словаре?;Добавляется новый ключ со значением 1.
"Каким будет словарь после обработки строки ""Hello"" на этапе после добавления первой 'l'?";"{""H"": 1, ""e"": 1, ""l"": 1}"
"Каким будет итоговый словарь для строки ""Hello"" после выполнения функции count?";"{""H"": 1, ""e"": 1, ""l"": 2, ""o"": 1}"
Что такое хеш-таблица?;Линейная структура данных, хранящая пары «ключ — значение» с уникальными ключами.
Какая временная сложность решения задачи «Сумма двух» с помощью хеш-таблицы?;O(n).
Какой подход используется в решении задачи «Сумма двух» с помощью словаря?;"Для каждого числа n вычисляется rem = target - n, и если rem есть в словаре, возвращаются индексы; иначе n добавляется в словарь с его индексом."
Что такое ассоциативный массив?;Абстрактный тип данных, хранящий пары «ключ — значение» с уникальными ключами.
Что такое коллизия в хеш-таблице?;Когда два числа получают одинаковое хеш-значение и попадают в один и тот же слот.
Какова временная сложность решения задачи «Сумма двух» методом грубой силы?;O(n^2).
Что такое хеш-функция?;Код, принимающий ключ в качестве входных данных и выводящий уникальный фрагмент данных, который сопоставляет ключ с индексом массива, используемого компьютером для хранения значения.
Что такое пара «ключ — значение»?;Два фрагмента данных, отображаемых вместе: ключ и значение.
Что такое хеш-значение?;Уникальное значение, которое производит хеш-функция.
Что такое интерфейс прикладного программирования (API)?;Программа, которая позволяет приложениям взаимодействовать друг с другом.
Что такое дерево в структурах данных?;Это нелинейный абстрактный тип данных, состоящий из узлов, объединенных в иерархическую структуру.
Какие общие операции выполняются с деревом?;Вставка, поиск и удаление.
Какие типы древовидных структур данных существуют?;Общие деревья, AVL-деревья, красно-черные деревья, двоичные деревья, двоичные деревья поиска и многие другие.
Что такое корневой узел в дереве?;Верхний узел дерева, с которого начинается структура.
Что такое дочерний узел?;Узел, соединенный с узлом, находящимся над ним в дереве.
Что такое родительский узел?;Узел с одним или более дочерними узлами.
Что такое братские узлы?;Узлы, имеющие общий родительский узел.
Что такое ребро в дереве?;Соединение между двумя узлами в дереве.
Как определить узел ветвления?;Узел с дочерними узлами.
Как определить лист в дереве?;Узел без дочерних узлов.
Что такое двоичное дерево?;Древовидная структура данных, в которой у каждого узла может быть только два дочерних узла.
Какие типы дочерних узлов различают в двоичном дереве?;Левый и правый дочерние элементы.
Чем двоичное дерево поиска отличается от обычного двоичного дерева?;Двоичное дерево поиска хранит узлы в отсортированном порядке: каждый узел больше любого значения в его левом поддереве и меньше любого значения в правом поддереве.
Можно ли хранить дубликаты значений в двоичном дереве поиска?;"Нельзя напрямую; для обработки дубликатов можно добавить поле счетчика в объекты узлов."
Что такое потомки узла?;Дети узла, их дети и так далее.
Почему для прохождения некоторых узлов в двоичном дереве нужно возвращаться назад?;Потому что, начиная с корневого узла, можно попасть только в потомков узла, и для достижения других ветвей нужно возвращаться к родительским узлам.
Какова временная сложность вставки, удаления и поиска в общем дереве и в двоичном дереве?;О(n).
Какова временная сложность операций в двоичном дереве поиска в среднем случае?;О(log n) для доступа, поиска, вставки и удаления.
Какова временная сложность операций в двоичном дереве поиска в худшем случае?;О(n) для всех операций.
Почему стоит использовать деревья, а не хеш-таблицы или массивы?;Деревья позволяют хранить иерархическую информацию (папки на компьютере, HTML/XML, арифметические выражения), которую сложно или невозможно представить в линейных структурах.
Какое преимущество двоичных деревьев поиска перед хеш-таблицами в использовании памяти?;Двоичным деревьям поиска не нужна дополнительная память, в отличие от хеш-таблиц, которые могут превышать объем данных в десять и более раз из-за коллизий.
Какое преимущество двоичных деревьев поиска перед хеш-таблицами в сортировке?;Двоичные деревья поиска позволяют быстро проходить данные в прямом и обратном порядке сортировки, а хеш-таблицы не хранят данные по порядку.
Как создать класс BinaryTree в Python?;"class BinaryTree:
    def __init__(self, value):
        self.key = value
        self.left_child = None
        self.right_child = None"
Как работает метод insert_left в BinaryTree?;Метод проверяет, равен ли left_child None. Если да, создает новый BinaryTree(value). Если нет, создает новый узел и помещает его в left_child, а предыдущий left_child становится дочерним нового узла.
Как работает метод insert_right в BinaryTree?;Метод проверяет, равен ли right_child None. Если да, создает новый BinaryTree(value). Если нет, создает новый узел и помещает его в right_child, а предыдущий right_child становится дочерним нового узла.
Что такое поддерево в контексте двоичного дерева?;Поддерево — это узел в дереве, отличный от корневого узла, и его потомки. У поддерева могут быть свои поддеревья.
Как деревья используются для представления HTML или XML?;HTML и XML теги можно вкладывать друг в друга, поэтому программисты хранят их в виде деревьев. Каждый узел представляет отдельный элемент, что удобно для работы с объектной моделью документа (DOM).
Как дерево используется для вычисления арифметического выражения, например 2 + 3 * 4?;Создается дерево разбора, где сначала вычисляется нижний уровень (3 * 4), затем итоговое решение (2 + 7). Это упорядоченное дерево, соответствующее синтаксису вычисления.
Что такое дерево разбора?;Дерево разбора — это упорядоченное дерево, которое хранит данные в соответствии с определенным типом синтаксиса, например с правилами вычисления математических выражений.
Как добавить левый дочерний узел в BinaryTree, если self.left_child равен None?;self.left_child = BinaryTree(value)
Как добавить левый дочерний узел в BinaryTree, если self.left_child уже существует?;"bin_tree = BinaryTree(value); bin_tree.left_child = self.left_child; self.left_child = bin_tree"
Что делает метод insert_right в классе BinaryTree?;Добавляет новый узел в правую сторону дерева, аналогично insert_left, но для правого дочернего узла.
Какие шаги выполняет insert_right при наличии существующего правого дочернего узла?;Создает новый объект BinaryTree, присваивает ему текущий правый дочерний узел, затем устанавливает новый узел как правый дочерний.
Как создать двоичное дерево с корнем 1 и добавить узлы 2 (слева), 3 (справа), 4 (слева от 2), 6 (справа от 4) и 5 (справа от 3)?;"tree = BinaryTree(1); tree.insert_left(2); tree.insert_right(3); tree.insert_left(4); tree.left_child.insert_right(6); tree.insert_right(5)"
Что такое обход в ширину (breadth-first traversal) двоичного дерева?;Метод просмотра каждого узла в дереве уровень за уровнем, начиная с корня (уровень 0) и до последнего уровня.
Как реализован поиск в ширину (breadth_first_search) в классе BinaryTree?;Используются два списка: current для текущего уровня и next для следующего. В цикле while по current проверяется совпадение ключей, дочерние узлы добавляются в next, затем current и next меняются местами.
Что возвращает метод breadth_first_search, если искомое значение найдено?;True
Что возвращает метод breadth_first_search, если значение не найдено?;False
Как инициализируется список current в методе breadth_first_search?;current = [self] — начинается с корневого узла.
Какое условие завершения цикла while в breadth_first_search?;Цикл продолжается, пока current не пуст (while current).
Что происходит, когда while завершается при поиске в ширину?;Возвращается False, потому что поиск в ширину не нашел n в дереве.
Какие существуют варианты обхода в глубину?;Прямой, обратный и симметричный.
Как определяется прямой обход в глубину?;Начинается с корня, затем движется влево, а затем вправо.
Как выглядит код для прямого обхода дерева?;def preorder(tree): if tree: print(tree.key) preorder(tree.left_child) preorder(tree.right_child)
Чем отличается обратный обход от прямого?;В обратном обходе значение узла выводится после рекурсивных вызовов.
Как выглядит код для обратного обхода?;def postorder(tree): if tree: postorder(tree.left_child) postorder(tree.right_child) print(tree.key)
Как выполняется симметричный обход?;Значение узла выводится между двумя рекурсивными вызовами: сначала левый потомок, затем узел, затем правый.
Как инвертировать двоичное дерево?;Посетить каждый узел и поменять местами его левые и правые дочерние элементы, например, используя поиск в ширину.
Что делает метод invert() в коде Python для двоичного дерева?;Метод invert() меняет местами левый и правый дочерние узлы для каждого узла в дереве, то есть инвертирует дерево. Обход выполняется в ширину: сначала обрабатываются узлы текущего уровня, потом следующего.
Как в методе invert() происходит обмен дочерних узлов?;Сначала значение node.left_child сохраняется во временную переменную tmp, затем node.left_child устанавливается равным node.right_child, а node.right_child — равным tmp.
Что такое дерево в структурах данных?;Дерево — это нелинейный абстрактный тип данных, состоящий из узлов, объединенных в иерархическую структуру.
Что такое корневой узел?;Корневой узел — это верхний узел дерева.
Что такое дочерний узел?;Дочерний узел — это узел, соединенный с родительским узлом, находящимся над ним в дереве.
Что такое родительский узел?;Родительский узел — это узел с одним или более дочерними узлами.
Что такое братские узлы?;Братские узлы — это узлы, имеющие общий родительский узел.
Что такое ребро в дереве?;Ребро — это соединение между двумя узлами в дереве.
Что такое лист в дереве?;Лист — это узел без дочерних узлов.
Что такое узел ветвления?;Узел ветвления — это узел, имеющий дочерние узлы.
Что такое двоичное дерево?;Двоичное дерево — это древовидная структура данных, в которой у каждого узла может быть только два дочерних узла.
Что такое двоичное дерево поиска?;Двоичное дерево поиска — это древовидная структура данных, где у каждого узла может быть только два дочерних узла, причем дерево хранит узлы в отсортированном порядке: значение каждого узла больше значения его левого дочернего узла и меньше значения его правого дочернего узла.
Что такое потомки в дереве?;Потомки — это дочерние узлы и их дети, и дети их детей, и так далее.
Что такое объектная модель документа?;Объектная модель документа — это не зависящий от языка интерфейс, моделирующий XML- и HTML-документы в виде дерева.
Что такое дерево разбора?;Дерево разбора — это упорядоченное дерево, которое хранит данные в соответствии с определенным типом синтаксиса, например, в соответствии с правилами вычисления выражения.
Что такое поддерево?;Поддерево — это узел в дереве, отличный от корневого узла, и его потомки.
Что такое обход в ширину?;Обход в ширину — это метод просмотра всех узлов в дереве путем посещения каждого узла уровень за уровнем.
Что такое поиск в ширину?;Поиск в ширину — это поиск с использованием обхода в ширину.
Что такое обход в глубину?;Обход в глубину — это посещение всех узлов двоичного дерева путем погружения как можно глубже в одном направлении, перед тем как переходить к следующему братскому узлу.
